{
  "task": {
    "id": "000000000004",
    "project": "000000000002",
    "projectName": "M31 halo in narrowband",
    "agent": "000000000001",
    "region": {
      "ra": 10.6847,
      "dec": 41.269,
      "width": 7.0,
      "height": 4.5,
      "rotation": 35.0
    },
    "filters": [
      {
        "filter": "H",
        "exposure": 300.0,
        "hours": 10.0
      },
      {
        "filter": "O",
        "exposure": 300.0,
        "hours": 10.0
      }
    ],
    "state": "accepted",
    "version": 3,
    "issued": 1791171029.0,
    "note": "joined by Vega 530",
    "seconds": 72000.0,
    "cells": [
      {
        "ra": 7.648994769812747,
        "dec": 39.769,
        "width": 2.53966267672956,
        "height": 1.6974441962264148,
        "rotation": 35.0,
        "row": 0,
        "column": 0
      },
      {
        "ra": 10.6847,
        "dec": 39.769,
        "width": 2.53966267672956,
        "height": 1.6974441962264148,
        "rotation": 35.0,
        "row": 0,
        "column": 1
      },
      {
        "ra": 13.720405230187254,
        "dec": 39.769,
        "width": 2.53966267672956,
        "height": 1.6974441962264148,
        "rotation": 35.0,
        "row": 0,
        "column": 2
      },
      {
        "ra": 7.580299025898128,
        "dec": 41.269,
        "width": 2.53966267672956,
        "height": 1.6974441962264148,
        "rotation": 35.0,
        "row": 1,
        "column": 0
      },
      {
        "ra": 10.6847,
        "dec": 41.269,
        "width": 2.53966267672956,
        "height": 1.6974441962264148,
        "rotation": 35.0,
        "row": 1,
        "column": 1
      },
      {
        "ra": 13.789100974101872,
        "dec": 41.269,
        "width": 2.53966267672956,
        "height": 1.6974441962264148,
        "rotation": 35.0,
        "row": 1,
        "column": 2
      },
      {
        "ra": 7.506193403991872,
        "dec": 42.769,
        "width": 2.53966267672956,
        "height": 1.6974441962264148,
        "rotation": 35.0,
        "row": 2,
        "column": 0
      },
      {
        "ra": 10.6847,
        "dec": 42.769,
        "width": 2.53966267672956,
        "height": 1.6974441962264148,
        "rotation": 35.0,
        "row": 2,
        "column": 1
      },
      {
        "ra": 13.863206596008128,
        "dec": 42.769,
        "width": 2.53966267672956,
        "height": 1.6974441962264148,
        "rotation": 35.0,
        "row": 2,
        "column": 2
      }
    ],
    "share": [
      0,
      1,
      2,
      3,
      4,
      5
    ],
    "kind": "mosaic",
    "visit": {
      "seconds": 3300.0,
      "frames": {
        "O": 11
      },
      "filter": "O",
      "moon": 0.036
    },
    "assignedNight": "2026-10-05",
    "assignedAt": 1791171033.0,
    "dealtHours": 6.0,
    "tiledRotation": null
  },
  "tasks": [
    {
      "id": "000000000004",
      "project": "000000000002",
      "projectName": "M31 halo in narrowband",
      "agent": "000000000001",
      "region": {
        "ra": 10.6847,
        "dec": 41.269,
        "width": 7.0,
        "height": 4.5,
        "rotation": 35.0
      },
      "filters": [
        {
          "filter": "H",
          "exposure": 300.0,
          "hours": 10.0
        },
        {
          "filter": "O",
          "exposure": 300.0,
          "hours": 10.0
        }
      ],
      "state": "accepted",
      "version": 3,
      "issued": 1791171029.0,
      "note": "joined by Vega 530",
      "seconds": 72000.0,
      "cells": [
        {
          "ra": 7.648994769812747,
          "dec": 39.769,
          "width": 2.53966267672956,
          "height": 1.6974441962264148,
          "rotation": 35.0,
          "row": 0,
          "column": 0
        },
        {
          "ra": 10.6847,
          "dec": 39.769,
          "width": 2.53966267672956,
          "height": 1.6974441962264148,
          "rotation": 35.0,
          "row": 0,
          "column": 1
        },
        {
          "ra": 13.720405230187254,
          "dec": 39.769,
          "width": 2.53966267672956,
          "height": 1.6974441962264148,
          "rotation": 35.0,
          "row": 0,
          "column": 2
        },
        {
          "ra": 7.580299025898128,
          "dec": 41.269,
          "width": 2.53966267672956,
          "height": 1.6974441962264148,
          "rotation": 35.0,
          "row": 1,
          "column": 0
        },
        {
          "ra": 10.6847,
          "dec": 41.269,
          "width": 2.53966267672956,
          "height": 1.6974441962264148,
          "rotation": 35.0,
          "row": 1,
          "column": 1
        },
        {
          "ra": 13.789100974101872,
          "dec": 41.269,
          "width": 2.53966267672956,
          "height": 1.6974441962264148,
          "rotation": 35.0,
          "row": 1,
          "column": 2
        },
        {
          "ra": 7.506193403991872,
          "dec": 42.769,
          "width": 2.53966267672956,
          "height": 1.6974441962264148,
          "rotation": 35.0,
          "row": 2,
          "column": 0
        },
        {
          "ra": 10.6847,
          "dec": 42.769,
          "width": 2.53966267672956,
          "height": 1.6974441962264148,
          "rotation": 35.0,
          "row": 2,
          "column": 1
        },
        {
          "ra": 13.863206596008128,
          "dec": 42.769,
          "width": 2.53966267672956,
          "height": 1.6974441962264148,
          "rotation": 35.0,
          "row": 2,
          "column": 2
        }
      ],
      "share": [
        0,
        1,
        2,
        3,
        4,
        5
      ],
      "kind": "mosaic",
      "visit": {
        "seconds": 3300.0,
        "frames": {
          "O": 11
        },
        "filter": "O",
        "moon": 0.036
      },
      "assignedNight": "2026-10-05",
      "assignedAt": 1791171033.0,
      "dealtHours": 6.0,
      "tiledRotation": null
    }
  ],
  "requirementsByProject": {
    "000000000002": {
      "minFocalLength": null,
      "maxFocalLength": null,
      "minScale": null,
      "maxScale": null,
      "acceptColour": true,
      "colourMaxMoon": null,
      "maxHfr": 3.5,
      "maxGuideRms": null,
      "minExposure": 120.0,
      "maxExposure": 600.0,
      "filters": {
        "H": 7.0,
        "O": 7.0
      },
      "maxMoonIllumination": null,
      "minMoonSeparation": 30.0,
      "minAltitude": 30.0,
      "requireCalibrated": false,
      "minFramesPerVisit": 10
    }
  },
  "version": 3,
  "protocol": 1,
  "requirements": {
    "minFocalLength": null,
    "maxFocalLength": null,
    "minScale": null,
    "maxScale": null,
    "acceptColour": true,
    "colourMaxMoon": null,
    "maxHfr": 3.5,
    "maxGuideRms": null,
    "minExposure": 120.0,
    "maxExposure": 600.0,
    "filters": {
      "H": 7.0,
      "O": 7.0
    },
    "maxMoonIllumination": null,
    "minMoonSeparation": 30.0,
    "minAltitude": 30.0,
    "requireCalibrated": false,
    "minFramesPerVisit": 10
  }
}
